{
  "$schema": "./element-roadmap.schema.json",
  "schemaVersion": 1,
  "updatedAt": "2026-09-21",
  "kind": "planning-manifest-not-runtime-properties",
  "description": "Delivery cohorts, not stability classifications or validated simulation claims. Existing eight legacy models are documented, not re-tested in this docs-only update.",
  "tierCounts": {
    "core": 40,
    "extended": 43,
    "nuclear": 20,
    "exotic": 15
  },
  "cumulativeTargets": [
    40,
    83,
    103,
    118
  ],
  "elements": [
    {
      "atomicNumber": 1,
      "symbol": "H",
      "name": "Hydrogen",
      "tier": "core",
      "targetPhase": "P4",
      "targetRepresentation": "elemental-material",
      "legacyModelDocumented": true,
      "newBackendStatus": "planned",
      "sourceIds": [
        "iupac-periodic-table"
      ]
    },
    {
      "atomicNumber": 2,
      "symbol": "He",
      "name": "Helium",
      "tier": "core",
      "targetPhase": "P4",
      "targetRepresentation": "elemental-material",
      "legacyModelDocumented": true,
      "newBackendStatus": "planned",
      "sourceIds": [
        "iupac-periodic-table"
      ]
    },
    {
      "atomicNumber": 3,
      "symbol": "Li",
      "name": "Lithium",
      "tier": "core",
      "targetPhase": "P4",
      "targetRepresentation": "elemental-material",
      "legacyModelDocumented": false,
      "newBackendStatus": "planned",
      "sourceIds": [
        "iupac-periodic-table"
      ]
    },
    {
      "atomicNumber": 4,
      "symbol": "Be",
      "name": "Beryllium",
      "tier": "extended",
      "targetPhase": "P5",
      "targetRepresentation": "elemental-material",
      "legacyModelDocumented": false,
      "newBackendStatus": "planned",
      "sourceIds": [
        "iupac-periodic-table"
      ]
    },
    {
      "atomicNumber": 5,
      "symbol": "B",
      "name": "Boron",
      "tier": "core",
      "targetPhase": "P4",
      "targetRepresentation": "elemental-material",
      "legacyModelDocumented": false,
      "newBackendStatus": "planned",
      "sourceIds": [
        "iupac-periodic-table"
      ]
    },
    {
      "atomicNumber": 6,
      "symbol": "C",
      "name": "Carbon",
      "tier": "core",
      "targetPhase": "P4",
      "targetRepresentation": "elemental-material",
      "legacyModelDocumented": true,
      "newBackendStatus": "planned",
      "sourceIds": [
        "iupac-periodic-table"
      ]
    },
    {
      "atomicNumber": 7,
      "symbol": "N",
      "name": "Nitrogen",
      "tier": "core",
      "targetPhase": "P4",
      "targetRepresentation": "elemental-material",
      "legacyModelDocumented": true,
      "newBackendStatus": "planned",
      "sourceIds": [
        "iupac-periodic-table"
      ]
    },
    {
      "atomicNumber": 8,
      "symbol": "O",
      "name": "Oxygen",
      "tier": "core",
      "targetPhase": "P4",
      "targetRepresentation": "elemental-material",
      "legacyModelDocumented": true,
      "newBackendStatus": "planned",
      "sourceIds": [
        "iupac-periodic-table"
      ]
    },
    {
      "atomicNumber": 9,
      "symbol": "F",
      "name": "Fluorine",
      "tier": "core",
      "targetPhase": "P4",
      "targetRepresentation": "elemental-material",
      "legacyModelDocumented": false,
      "newBackendStatus": "planned",
      "sourceIds": [
        "iupac-periodic-table"
      ]
    },
    {
      "atomicNumber": 10,
      "symbol": "Ne",
      "name": "Neon",
      "tier": "core",
      "targetPhase": "P4",
      "targetRepresentation": "elemental-material",
      "legacyModelDocumented": false,
      "newBackendStatus": "planned",
      "sourceIds": [
        "iupac-periodic-table"
      ]
    },
    {
      "atomicNumber": 11,
      "symbol": "Na",
      "name": "Sodium",
      "tier": "core",
      "targetPhase": "P4",
      "targetRepresentation": "elemental-material",
      "legacyModelDocumented": false,
      "newBackendStatus": "planned",
      "sourceIds": [
        "iupac-periodic-table"
      ]
    },
    {
      "atomicNumber": 12,
      "symbol": "Mg",
      "name": "Magnesium",
      "tier": "core",
      "targetPhase": "P4",
      "targetRepresentation": "elemental-material",
      "legacyModelDocumented": false,
      "newBackendStatus": "planned",
      "sourceIds": [
        "iupac-periodic-table"
      ]
    },
    {
      "atomicNumber": 13,
      "symbol": "Al",
      "name": "Aluminium",
      "tier": "core",
      "targetPhase": "P4",
      "targetRepresentation": "elemental-material",
      "legacyModelDocumented": false,
      "newBackendStatus": "planned",
      "sourceIds": [
        "iupac-periodic-table"
      ]
    },
    {
      "atomicNumber": 14,
      "symbol": "Si",
      "name": "Silicon",
      "tier": "core",
      "targetPhase": "P4",
      "targetRepresentation": "elemental-material",
      "legacyModelDocumented": false,
      "newBackendStatus": "planned",
      "sourceIds": [
        "iupac-periodic-table"
      ]
    },
    {
      "atomicNumber": 15,
      "symbol": "P",
      "name": "Phosphorus",
      "tier": "core",
      "targetPhase": "P4",
      "targetRepresentation": "elemental-material",
      "legacyModelDocumented": false,
      "newBackendStatus": "planned",
      "sourceIds": [
        "iupac-periodic-table"
      ]
    },
    {
      "atomicNumber": 16,
      "symbol": "S",
      "name": "Sulfur",
      "tier": "core",
      "targetPhase": "P4",
      "targetRepresentation": "elemental-material",
      "legacyModelDocumented": true,
      "newBackendStatus": "planned",
      "sourceIds": [
        "iupac-periodic-table"
      ]
    },
    {
      "atomicNumber": 17,
      "symbol": "Cl",
      "name": "Chlorine",
      "tier": "core",
      "targetPhase": "P4",
      "targetRepresentation": "elemental-material",
      "legacyModelDocumented": false,
      "newBackendStatus": "planned",
      "sourceIds": [
        "iupac-periodic-table"
      ]
    },
    {
      "atomicNumber": 18,
      "symbol": "Ar",
      "name": "Argon",
      "tier": "core",
      "targetPhase": "P4",
      "targetRepresentation": "elemental-material",
      "legacyModelDocumented": false,
      "newBackendStatus": "planned",
      "sourceIds": [
        "iupac-periodic-table"
      ]
    },
    {
      "atomicNumber": 19,
      "symbol": "K",
      "name": "Potassium",
      "tier": "core",
      "targetPhase": "P4",
      "targetRepresentation": "elemental-material",
      "legacyModelDocumented": false,
      "newBackendStatus": "planned",
      "sourceIds": [
        "iupac-periodic-table"
      ]
    },
    {
      "atomicNumber": 20,
      "symbol": "Ca",
      "name": "Calcium",
      "tier": "core",
      "targetPhase": "P4",
      "targetRepresentation": "elemental-material",
      "legacyModelDocumented": false,
      "newBackendStatus": "planned",
      "sourceIds": [
        "iupac-periodic-table"
      ]
    },
    {
      "atomicNumber": 21,
      "symbol": "Sc",
      "name": "Scandium",
      "tier": "extended",
      "targetPhase": "P5",
      "targetRepresentation": "elemental-material",
      "legacyModelDocumented": false,
      "newBackendStatus": "planned",
      "sourceIds": [
        "iupac-periodic-table"
      ]
    },
    {
      "atomicNumber": 22,
      "symbol": "Ti",
      "name": "Titanium",
      "tier": "core",
      "targetPhase": "P4",
      "targetRepresentation": "elemental-material",
      "legacyModelDocumented": false,
      "newBackendStatus": "planned",
      "sourceIds": [
        "iupac-periodic-table"
      ]
    },
    {
      "atomicNumber": 23,
      "symbol": "V",
      "name": "Vanadium",
      "tier": "extended",
      "targetPhase": "P5",
      "targetRepresentation": "elemental-material",
      "legacyModelDocumented": false,
      "newBackendStatus": "planned",
      "sourceIds": [
        "iupac-periodic-table"
      ]
    },
    {
      "atomicNumber": 24,
      "symbol": "Cr",
      "name": "Chromium",
      "tier": "core",
      "targetPhase": "P4",
      "targetRepresentation": "elemental-material",
      "legacyModelDocumented": false,
      "newBackendStatus": "planned",
      "sourceIds": [
        "iupac-periodic-table"
      ]
    },
    {
      "atomicNumber": 25,
      "symbol": "Mn",
      "name": "Manganese",
      "tier": "extended",
      "targetPhase": "P5",
      "targetRepresentation": "elemental-material",
      "legacyModelDocumented": false,
      "newBackendStatus": "planned",
      "sourceIds": [
        "iupac-periodic-table"
      ]
    },
    {
      "atomicNumber": 26,
      "symbol": "Fe",
      "name": "Iron",
      "tier": "core",
      "targetPhase": "P4",
      "targetRepresentation": "elemental-material",
      "legacyModelDocumented": true,
      "newBackendStatus": "planned",
      "sourceIds": [
        "iupac-periodic-table"
      ]
    },
    {
      "atomicNumber": 27,
      "symbol": "Co",
      "name": "Cobalt",
      "tier": "core",
      "targetPhase": "P4",
      "targetRepresentation": "elemental-material",
      "legacyModelDocumented": false,
      "newBackendStatus": "planned",
      "sourceIds": [
        "iupac-periodic-table"
      ]
    },
    {
      "atomicNumber": 28,
      "symbol": "Ni",
      "name": "Nickel",
      "tier": "core",
      "targetPhase": "P4",
      "targetRepresentation": "elemental-material",
      "legacyModelDocumented": false,
      "newBackendStatus": "planned",
      "sourceIds": [
        "iupac-periodic-table"
      ]
    },
    {
      "atomicNumber": 29,
      "symbol": "Cu",
      "name": "Copper",
      "tier": "core",
      "targetPhase": "P4",
      "targetRepresentation": "elemental-material",
      "legacyModelDocumented": true,
      "newBackendStatus": "planned",
      "sourceIds": [
        "iupac-periodic-table"
      ]
    },
    {
      "atomicNumber": 30,
      "symbol": "Zn",
      "name": "Zinc",
      "tier": "core",
      "targetPhase": "P4",